{
  "$schema": "./schema-v0.json",
  "schemaVersion": "fairyc.result-fixtures/v0",
  "deferred": [
    "cross-package public must-use summaries until package interfaces exist",
    "backend tagged layout identity until the first code-generation contract"
  ],
  "contracts": [
    "docs/product/02-spec.md",
    "docs/adr/0012-stage-0-region-and-result-fixture-contracts.md",
    "docs/adr/0017-stage-0-result-constructors-and-match.md",
    "docs/adr/0019-stage-0-result-must-use-dataflow.md",
    "docs/adr/0024-stage-0-loop-control-and-cleanup.md",
    "docs/language/0004-results-traps-and-control-flow.md",
    "docs/mir/drop-elaboration-v0.md",
    "docs/diagnostics/catalog-v0.md"
  ],
  "cases": [
    {
      "id": "pass.flow.return-result",
      "sourceRoot": "cases/pass/return-result/src",
      "sources": ["main.fy"],
      "expect": {
        "status": "pass",
        "completedThrough": "flow",
        "handling": [
          {
            "expression": {
              "source": "main.fy",
              "startByte": 111,
              "endByte": 116
            },
            "mode": "return",
            "resultType": "Result<i32, Error>",
            "successType": "i32",
            "errorType": "Error",
            "evaluationCount": 1
          }
        ]
      }
    },
    {
      "id": "pass.flow.discard-result",
      "sourceRoot": "cases/pass/discard-result/src",
      "sources": ["main.fy"],
      "expect": {
        "status": "pass",
        "completedThrough": "flow",
        "handling": [
          {
            "expression": {
              "source": "main.fy",
              "startByte": 96,
              "endByte": 101
            },
            "mode": "discard",
            "resultType": "Result<i32, Error>",
            "successType": "i32",
            "errorType": "Error",
            "evaluationCount": 1
          }
        ]
      }
    },
    {
      "id": "pass.flow.propagate-result",
      "sourceRoot": "cases/pass/propagate-result/src",
      "sources": ["main.fy"],
      "expect": {
        "status": "pass",
        "completedThrough": "flow",
        "handling": [
          {
            "expression": {
              "source": "main.fy",
              "startByte": 151,
              "endByte": 157
            },
            "mode": "propagate",
            "resultType": "Result<i32, Error>",
            "successType": "i32",
            "errorType": "Error",
            "evaluationCount": 1
          }
        ]
      }
    },
    {
      "id": "pass.flow.construct-result",
      "sourceRoot": "cases/pass/construct-result/src",
      "sources": ["main.fy"],
      "expect": {
        "status": "pass",
        "completedThrough": "flow",
        "handling": [
          {
            "expression": {
              "source": "main.fy",
              "startByte": 55,
              "endByte": 62
            },
            "mode": "return",
            "resultType": "Result<i32, i32>",
            "successType": "i32",
            "errorType": "i32",
            "evaluationCount": 1
          }
        ]
      }
    },
    {
      "id": "pass.flow.match-result",
      "sourceRoot": "cases/pass/match-result/src",
      "sources": ["main.fy"],
      "expect": {
        "status": "pass",
        "completedThrough": "flow",
        "handling": [
          {
            "expression": {
              "source": "main.fy",
              "startByte": 73,
              "endByte": 78
            },
            "mode": "match",
            "resultType": "Result<i32, i32>",
            "successType": "i32",
            "errorType": "i32",
            "evaluationCount": 1
          }
        ]
      }
    },
    {
      "id": "pass.flow.stored-discard",
      "sourceRoot": "cases/pass/stored-discard/src",
      "sources": ["main.fy"],
      "expect": {
        "status": "pass",
        "completedThrough": "flow",
        "handling": [
          {
            "expression": {
              "source": "main.fy",
              "startByte": 87,
              "endByte": 94
            },
            "mode": "discard",
            "resultType": "Result<i32, i32>",
            "successType": "i32",
            "errorType": "i32",
            "evaluationCount": 1
          }
        ]
      }
    },
    {
      "id": "pass.flow.branch-all-handled",
      "sourceRoot": "cases/pass/branch-all-handled/src",
      "sources": ["main.fy"],
      "expect": {
        "status": "pass",
        "completedThrough": "flow",
        "handling": [
          {
            "expression": {
              "source": "main.fy",
              "startByte": 96,
              "endByte": 101
            },
            "mode": "discard",
            "resultType": "Result<i32, i32>",
            "successType": "i32",
            "errorType": "i32",
            "evaluationCount": 1
          },
          {
            "expression": {
              "source": "main.fy",
              "startByte": 132,
              "endByte": 137
            },
            "mode": "discard",
            "resultType": "Result<i32, i32>",
            "successType": "i32",
            "errorType": "i32",
            "evaluationCount": 1
          }
        ]
      }
    },
    {
      "id": "pass.flow.transfer-parameter",
      "sourceRoot": "cases/pass/transfer-parameter/src",
      "sources": ["main.fy"],
      "expect": {
        "status": "pass",
        "completedThrough": "flow",
        "handling": [
          {
            "expression": {
              "source": "main.fy",
              "startByte": 67,
              "endByte": 72
            },
            "mode": "discard",
            "resultType": "Result<i32, i32>",
            "successType": "i32",
            "errorType": "i32",
            "evaluationCount": 1
          }
        ]
      }
    },
    {
      "id": "pass.flow.branch-produced-local",
      "sourceRoot": "cases/pass/branch-produced-local/src",
      "sources": ["main.fy"],
      "expect": {
        "status": "pass",
        "completedThrough": "flow",
        "handling": [
          {
            "expression": {
              "source": "main.fy",
              "startByte": 151,
              "endByte": 158
            },
            "mode": "discard",
            "resultType": "Result<i32, i32>",
            "successType": "i32",
            "errorType": "i32",
            "evaluationCount": 1
          }
        ]
      }
    },
    {
      "id": "pass.flow.local-transfer",
      "sourceRoot": "cases/pass/local-transfer/src",
      "sources": ["main.fy"],
      "expect": {
        "status": "pass",
        "completedThrough": "flow",
        "handling": [
          {
            "expression": {
              "source": "main.fy",
              "startByte": 109,
              "endByte": 118
            },
            "mode": "discard",
            "resultType": "Result<i32, i32>",
            "successType": "i32",
            "errorType": "i32",
            "evaluationCount": 1
          }
        ]
      }
    },
    {
      "id": "pass.flow.handled-reassignment",
      "sourceRoot": "cases/pass/handled-reassignment/src",
      "sources": ["main.fy"],
      "expect": {
        "status": "pass",
        "completedThrough": "flow",
        "handling": [
          {
            "expression": {
              "source": "main.fy",
              "startByte": 86,
              "endByte": 93
            },
            "mode": "discard",
            "resultType": "Result<i32, i32>",
            "successType": "i32",
            "errorType": "i32",
            "evaluationCount": 1
          },
          {
            "expression": {
              "source": "main.fy",
              "startByte": 129,
              "endByte": 136
            },
            "mode": "discard",
            "resultType": "Result<i32, i32>",
            "successType": "i32",
            "errorType": "i32",
            "evaluationCount": 1
          }
        ]
      }
    },
    {
      "id": "fail.flow.unused-result",
      "sourceRoot": "cases/fail/unused-result/src",
      "sources": ["main.fy"],
      "expect": {
        "status": "fail",
        "phase": "flow",
        "diagnostics": [
          {
            "code": "E4101",
            "primary": {
              "source": "main.fy",
              "startByte": 89,
              "endByte": 94
            },
            "related": []
          }
        ]
      }
    },
    {
      "id": "fail.flow.stored-unhandled",
      "sourceRoot": "cases/fail/stored-unhandled/src",
      "sources": ["main.fy"],
      "expect": {
        "status": "fail",
        "phase": "flow",
        "diagnostics": [
          {
            "code": "E4101",
            "primary": {
              "source": "main.fy",
              "startByte": 68,
              "endByte": 75
            },
            "related": []
          }
        ]
      }
    },
    {
      "id": "fail.flow.parameter-unhandled",
      "sourceRoot": "cases/fail/parameter-unhandled/src",
      "sources": ["main.fy"],
      "expect": {
        "status": "fail",
        "phase": "flow",
        "diagnostics": [
          {
            "code": "E4101",
            "primary": {
              "source": "main.fy",
              "startByte": 46,
              "endByte": 51
            },
            "related": []
          }
        ]
      }
    },
    {
      "id": "fail.flow.overwrite-unhandled",
      "sourceRoot": "cases/fail/overwrite-unhandled/src",
      "sources": ["main.fy"],
      "expect": {
        "status": "fail",
        "phase": "flow",
        "diagnostics": [
          {
            "code": "E4101",
            "primary": {
              "source": "main.fy",
              "startByte": 68,
              "endByte": 74
            },
            "related": []
          }
        ]
      }
    },
    {
      "id": "fail.flow.branch-partial-handle",
      "sourceRoot": "cases/fail/branch-partial-handle/src",
      "sources": ["main.fy"],
      "expect": {